{
  "envelope_version": 1,
  "job_id": "01923f4e-7b3a-7c2d-9f10-3a4b5c6d7e8f",
  "type": "crawl.fetch",
  "org_id": "01923f4e-7b3a-7c2d-9f10-000000000001",
  "research_job_id": "01923f4e-7b3a-7c2d-9f10-00000000abcd",
  "idempotency_key": "rj:crawl.fetch:abc",
  "attempt": 1,
  "priority": "interactive",
  "budget": {
    "credits_remaining": 0,
    "cost_cap_micros": 0
  },
  "trace_id": "4bf92f3577b34da6a3ce929d0e0e4736",
  "payload": {
    "message": "hello"
  },
  "created_at": "2026-09-18T10:00:00Z"
}
